id,business_blank,business_categories,business_city,business_full_address,business_id,business_latitude,business_longitude,business_name,business_neighborhoods,business_open,business_review_count,business_stars,business_state,business_type,cool,date,funny,review_id,reviewer_average_stars,reviewer_blank,reviewer_cool,reviewer_funny,reviewer_name,reviewer_review_count,reviewer_type,reviewer_useful,stars,text,type,useful,user_id
208854,FALSE,Restaurants; Italian,Scottsdale,"6339 E Greenway Rd
Ste 108
Scottsdale, AZ 85254",gHKB66up5VluCWT4vuSZpw,33.624662,-111.943525,Tutti Santi By Nina,NA,TRUE,76,4,AZ,business,0,10/23/2009,0,eYMNhO6aH2s6oheViaLGwg,0,TRUE,0,0,NA,0,user,0,5,"As a geezer who never claims Omg. 

OMFG.

This places makes you wish you had Pavarotti's lungs and a full cello suite. 

Great food, great service. Order the Veal Francese or the Veal Marsala, with the inky Super Tuscan; Modus 2006 Ruffino.

The Tiramisu was superlative.

This is the ONLY place in Arizona I would put on par with my favorite comfort-preset phenomena: Flemings.

Do try it.

As for the 'strip-mall' woes below me; note that you're not on the pavement, yeah? Once you're in, you're in. 2 stars is bogus Scrapbooking-PMS whining. Get with the program, lass.",review,0,bkYKrAbREHReX5bFVYET6A
224744,FALSE,Bars; American (New); Nightlife; Lounges; Restaurants,Phoenix,"5455 E High St
Ste 101
Phoenix, AZ 85054",ttLtsY1S2Angj6hvEdzwDQ,33.6753306,-111.9633729,Blue Martini,NA,TRUE,107,3.5,AZ,business,0,6/11/2012,0,96GZmI9T-_AG4MfAO8dnKQ,3.7,FALSE,0,0,Lance,10,user,3,4,"Had a great time with my beautiful wife listening to The Instant Classics. Drinks are pricey and menu seems a little limited, but I had a great time. Looking forward sharing Blue Martini and TIC with friends.",review,0,p5jXjPeG-lh8lOwFioboZg
16643,FALSE,Dive Bars; Bars; Nightlife,Scottsdale,"4310 N Brown Ave
Scottsdale, AZ 85251",SjFl_V6BTGkmv4tbub-AVw,33.49867,-111.924644,Mickey's Hangover,NA,FALSE,51,3.5,AZ,business,0,4/8/2008,0,n-gpBMjvJF0fpnNBSYybqg,3.4,FALSE,43,86,JENNY,112,user,106,1,"OK, I know this is classified as a ""dive bar"" but the smell of vomit was so over powering last Sunday night that we walked in and walked right out.  My friend had the dry heaves all the way to the Saddle Ranch.",review,1,PdjTAOxX3sjAAXTZJJyJvw
141259,FALSE,American (New); Restaurants,Phoenix,"2 E Jefferson St
Phoenix, AZ 85004",kr3EFhoSwbJPrL_e_RD39g,33.4471735,-112.073781,Blue Hound Kitchen & Cocktails,NA,TRUE,80,3.5,AZ,business,0,12/13/2012,1,CXp_3u1UIRqxQKhZq21Qlg,3.58,FALSE,7,10,Kevin,105,user,41,1,"Awful service and marginal food at best. Way over cooked.

That said, it's a lovely setting with immense, but unfulfilled, potential.

The outdoor patio and tater tots were the highlight of a marginal experience.",review,0,sM_5WWwzsKomERthYdmd7w
141061,FALSE,Bars; American (New); Nightlife; Restaurants,Phoenix,"816 N 3rd St
Phoenix, AZ 85004",7cP7WFmWiTVh-raIL3N_Vw,33.4571599,-112.0699779,The Roosevelt,NA,FALSE,224,4,AZ,business,7,1/21/2010,9,bjzqc1hy_yLcAhPzq8lxfg,4.14,FALSE,66,103,Collin,7,user,68,3,"Ok look, I understand that anything can become a cult classic when a few people known to be ""cool"" deem it ""magical"".  Picture somebody you really like and want to be your friend saying these things in a really annoying dramatic tone; ""Oh my god, I have to have it right now!"".  ""This is the best thing on the planet!!""  ""Dude, you're insane if you don't love this.""  I bet you can guess what I'm referring to by now, it is indeed the infamous Grilled Cheese and Tomato soup ""snack"" bonered over by pretty much everybody I've ever met in CenPho.  Now I'll be honest, I've only been to the Roosevelt twice, and actually had a good time both times, but I had to give it 3 stars for a couple little nit-picky things, as well as the fact that I'm anti-bandwagon when it comes to sports, and food.  

Really?!  I had better tomato soup on Continental Airlines for christ's sake.  I am not a big soup eater, but I've always appreciated tomato soup for its dip-ability, and simplicity.  I dont need a full salad of basil in the soup, and honestly I found it kinda watery.  Again, maybe its just because of the people who its got bent over telling me how bomb it is, but all I could think was ""meh"".  

I can also cook a better grilled cheese with the bread from Tent City (don't worry about why I know what the Tent City bread is like) on a linoleum countertop with a clothes iron, while getting robbed, attacked by a wild boar (which I would subdue with the iron), and nagged by the super annoying chick that I mistakenly dated for a couple weeks last year.  I'm not a foodie, so I don't remember specifically what kind of bread and cheeses were used, but I do remember waaaay to much of said bread, and not nearly enough cheese, for 8 bucks.  8 bucks?!  Send me to Safeway, fuck that, Food City with 8 bucks and I'll make you a grilled cheese and tomato soup that will leave you begging for a cigarette.  

But I digress.  Actually, overall, I like the Roosevelt.  The high top tables were rickety as shit and the little candle on the table served more as a way for me to burn myself testing my manhood by holding my hand over it than a light source.  The place itself is cute, and I've always liked places that have a homey feel.  Our waitress was wonderful, and even gave us some in depth info on where they get some of their ingredients.  I have one more gripe, and it's that I was apparently an asshole for asking for a bourbon, and not knowing before I stepped inside that they only serve beer and wine.  The bartender looked at me like I was a moron (which she has every right to do b/c she's dead on) and told me to rethink my selection of Wild Turkey on the rocks.  I love Oak Creek, so I was pleased to see that they carried it, but I think they probably lose the business of some people looking for a cocktail.

So, I'm more than confident that you will enjoy the Roosevelt, but if somebody tells you that you'll never have a better grilled cheese in your life, go in with the mentality that they're just making sure that the chick/dude they're lusting after thinks they have good taste.  You'll never get her anyway broseph.",review,6,vXnfpkOK2djHNVsUxpSioQ
210984,FALSE,Bars; Music Venues; Arts & Entertainment; Dive Bars; Nightlife; Lounges,Scottsdale,"8005 E Roosevelt St
Scottsdale, AZ 85250",axNlxFkTSFqivM_k36k0BA,33.4577445,-111.9081615,Chaser's Nightclub,NA,TRUE,16,3.5,AZ,business,0,4/25/2009,0,Y2qAJ69DUG0oaSk44zmHZw,3.99,FALSE,2025,1209,Michael,900,user,2685,3,"Went here for the Fender Band Jam event with some friends last night (fundraising for Habitat for Humanity).

This is a big dive bar, but it can be pretty fun when it's busy... Cheap drinks, live music, pool, darts... they do not have a smoking patio unfortunately. 

If a band that you like plays here, it's worth the trip...",review,1,90a6z--_CUrl84aCzZyPsg
31688,FALSE,Seafood; Mexican; Restaurants,Phoenix,"1605 E Garfield St
Phoenix, AZ 85006",Cp6JGY5YIRncTV_My9nf9g,33.4576266,-112.0474748,Mariscos Playa Hermosa,NA,TRUE,84,4.5,AZ,business,1,2/14/2012,0,Jn1STE_ZMK9jB40-x4QWXA,3.94,FALSE,104,112,Stephanie,192,user,225,5,"Okay, so I'm just a Bostonian who has basically been totally awed by Arizona in general, but seriously this place was totally amazing.

Not only did they give us salsa and chips (both delicious) to start our meal, but also a small serving of cerviche which was fantastic. And the meals were SO BIG. We were just two people, and after we both ordered a meal and a margharita, the waiter asked us, ""is that all?"" and we were worried we hadn't ordered enough but it turned out we ordered too much. And oh my gosh it was so good.

The server recommended shrimp in green sauce, and we also go the octopus. Amazing! As a side note, the beer serving was also huge. The atmosphere was perfect, there was copious parking, the restaurant was maybe a 7 minute drive from our car rental. Everything was for the win!

They do close early (at least when we were there) so keep that in mind. But oh my gosh, thank you for your incredible Mexican food!",review,2,sz9n4lecP_i63iGEngCyxA
55480,FALSE,Korean; Restaurants,Glendale,"4920 W Thunderbird Rd
Ste 117
Glendale, AZ 85311",6Y-6Y6sy6qOQHrWI37zR1Q,33.6116508,-112.165568,Chuhgajib Korean BBQ,NA,TRUE,84,3.5,AZ,business,0,8/14/2009,0,GJhTLVKb3E4UE12xYi40sg,3.87,FALSE,31,51,Vicki,61,user,90,3,"My friend took me to this Korean BBW a week ago on a Sunday. It is located in a strip mall across from ASU - West. Upon entering the first thing i noticed was the furniture made of trees. It's really different and fun!
I cannot remember what we ordered but first we were served 6 or so small white bowls with cold vegetables. I was not impressed, although the cold potatoes weren't vomitous.
Then came the sizzling strips of beef and THAT was delicious, some of the best tasting strips of beef I've ever devoured.

I would say if you like Korean food, you would enjoy this place. I am not a fan of Korean food but I would eat those strips of beef anyday.",review,0,IwxFKXDokKZdiD5iUdJPgQ
59465,FALSE,American (New); Restaurants,Phoenix,"4750 N Central Ave
Phoenix, AZ 85012",AaKlegu7gmOCD4rEESF76Q,33.5071469,-112.0744706,Maizie's Cafe & Bistro,NA,TRUE,258,4,AZ,business,2,6/6/2011,2,xNUo1fbCq3xaTCcq6XYV0Q,3.45,FALSE,336,308,Vern,190,user,564,3,"Went to @Maizies strictly for cocktails.

I love the patio. The misters became a bit much for my companion, so we switched places. Hat FTW!

Liked the Hoegaarden draught.

We were well attended to, which is nice.

I'll write more next time, when I eat something.",review,2,7cR92zkDv4W3kqzii6axvg
38580,FALSE,American (New); Restaurants,Phoenix,"5816 N 16th St
Phoenix, AZ 85016",Pfb6VOIiroqDWOebfgWGPQ,33.5229858,-112.0476585,Phoenix City Grille,NA,TRUE,134,4,AZ,business,0,3/7/2007,0,apDT_xc8yIzONVdviL77cw,0,TRUE,0,0,NA,0,user,0,4,"I wish I could remember the name of the pasta I had here, but I can't! And I can't find their website to look at their menu either.  All I can tell you is that it was delicious and I was the envy of all the diners at my table.  I could see everyone eyeing my pasta and wishing that they had got what I did.  AND it was pretty big, so I ended up taking half of it home with me. Nice!

For dessert, I had the pumpkin cheesecake, which was amazing.  Really, really good. Definitely give this place a try!",review,1,0CMz8YaO3f8xu4KqQgKb9Q
190080,FALSE,Pizza; Restaurants,Phoenix,"1135 E Glendale Ave
Phoenix, AZ 85020",GvwDppcJLm9lso9iS2hSIw,33.5382586,-112.0571061,Pat's Pizza Plus,NA,TRUE,48,4,AZ,business,1,2/27/2011,1,wiLy7YOAF5PriY7MBxpkIA,3.29,FALSE,1502,1492,Albert,1107,user,2132,4,"Sicilian and standard pizzas were fairly good.  Spaghetti was alright.  Prices were reasonable.  The small family owned feel is obvious, especially with the assinine signs about not taking the magazines and such.  Hardly any seating inside, so plan on takeout.",review,1,joIzw_aUiNvBTuGoytrH7g
46715,FALSE,Restaurants; American (New); Karaoke; Nightlife,Scottsdale,"4013 N Brown Ave
Scottsdale, AZ 85251",z6vO1HR8L2iW4avr610XKw,33.494295,-111.924219,The Grapevine,NA,TRUE,89,3,AZ,business,8,3/1/2012,8,LfMxBynys4xubTSeSxlrCw,3.31,FALSE,870,930,Dave,146,user,947,5,"Always I have found a good time here! Downstairs they have 'Cowboy Karaoke' the local old timers singing old time hits... And you know what? It's always entertaining. I've met and had great conversations with the bar patrons. Been upstairs with the tiki torches going on cool evenings with the younger crowd too. Something for everyone at The Vine. One time really drunk I looked over an saw Elvis enjoying himself here as well. Well bourbon in a short glass with coke, nice price, very reasonable so I'll stay for another, and maybe get a bite to eat. Here you will find the real old west of scottsdale, that you've been looking for",review,8,x3be6uxIqd9Dypu-o9KsKg
159059,FALSE,Mexican; Restaurants,Tolleson,"9820 W Lower Buckeye Rd Ste 103
Tolleson, AZ 85353",4zkNU2m_LKPo2h790zfXAw,33.421215,-112.269912,Viva Mexican Grill,NA,TRUE,7,3,AZ,business,1,2/7/2011,0,y71LQZQtjDXnL_bv3ZACiQ,3.97,FALSE,116,50,Gina,77,user,173,3,"So, I returned and tried a lengua(beef tongue) mini taco. Once again, delicious, with melt-in-your-mouth tender cubes of meat, and the lovely contrast of raw onions and cabbage.

their tortilla chips? not that great...they were too hard, too greasy, although they did have a good amount of salt. I had them with their salsa...very spicy and smoky, but it was more of a bean salsa(not chunky, but a powerful flavor of beans...not my thing).",review,1,xdhu_CZVomaGPD2qB0IQXw
83594,FALSE,Food; Coffee & Tea,Phoenix,"5410 E High St
Ste 115
Phoenix, AZ 85054",Kqn4J9NTgZdMAnV4HuYh5A,33.67585423,-111.9667339,Press Coffee,NA,FALSE,61,4.5,AZ,business,0,11/5/2010,0,W6s-18UjBZ-FqfYwD64okQ,3.49,FALSE,36,63,Ryan,63,user,72,5,"I have been going there at least once a week since they opened (for food and coffee) and the staff is always pleasant, the food is always good and the coffee is always terrific! Great atmosphere inside and out. So glad to hear they are opening another store at Scottsdale Quarter! Now I can finally get some GOOD coffee when I am in the Kierland area!",review,0,Da4aw-NF9ond8U6XYRmT0g
162791,FALSE,Piano Bars; Seafood; Steakhouses; Nightlife; Restaurants,Scottsdale,"15169 N Scottsdale Rd
Scottsdale, AZ 85254",WSHQ9qpL39g5xA3E5iBCmw,33.6239133,-111.9251335,Michael Dominick's Lincoln Avenue Prime Steakhouse,NA,TRUE,73,3.5,AZ,business,0,11/22/2011,0,5-f6IvON0xk-qEkwWLjMrw,2.5,FALSE,0,0,Bonnie,2,user,4,3,"Had my birthday dinner last Thursday.  Food was only fair but the service was very disappointing.  Empty bottles were left on the table, had to ask for water refills, waiter did not know this was a special occasion in spite of the information given in the reservation.  The waiter was not knowledgeable about the menu items (other than the steak), forgot the side dishes.  We had oysters and they were sandy.  The main courses looked as if they were just tossed onto the plates.  The ""Valli"" cheescake was made with so much whipped cream it was just too rich.
When compared with the Capitol Grille, they are really a distant second.",review,1,LZfWPkv9FnOHdnNLmp-0Nw
74255,FALSE,Day Spas; Tanning; Beauty & Spas,Scottsdale,"Steven Paul Salon
7045 E 3rd Ave
Scottsdale, AZ 85251",Md6b40dplJRSaxsu0_usgg,33.4961,-111.929344,Bronzeology: the Art of Custom Airbrush Tanning,NA,TRUE,4,5,AZ,business,1,6/25/2012,1,9eMmLhS4r4od1C4GHyXkcg,0,TRUE,0,0,NA,0,user,0,5,"Two days before I had to be at a wedding in California, I came to Brenna. I had gotten a spray tan at a salon within the past year and it was orange and streaky and absolutely terrible, so I was really nervous about it... but I was pale and it had to be done!

Brenna was sweet, enthusiastic, and comforting all in one little adorable Chicago-transplant package. She explained what she was going to do before she did it and was incredibly professional. I told her about my trip and how family would be there, so I didn't want to go too crazy, so she mixed up the color based on our conversation and my results were fantastic! Dark enough to look like I'd been sitting by the pool for days and light enough so I didn't look like I was trying too hard. No drips, no orange tinge, no brown elbows and it looked great my whole trip. Why don't I do this more often!?",review,1,GPchh5Jw7Go8nhI7WqF-ug
109685,FALSE,Food; Desserts; Ice Cream & Frozen Yogurt,Tempe,"514 S Mill Ave
Ste 102
Tempe, AZ 85281",AsSCv0q_BWqIe3mX2JqsOQ,33.42488026,-111.9401988,Cookiez On Mill,NA,FALSE,74,4,AZ,business,0,1/5/2010,0,nunjTwpEhXGefTybcFeabg,3.87,FALSE,58,27,Chelsea,62,user,86,4,"Hmm...try not to miss this on Mill or you will regret it. It was a delicious treat at the end of a night. The baked cookies with which you can stack one of a few very mouthwatering ice creams on top of, were awesome, and like I said just pick one of  the awesome ice creams to go with it. I did a half size and was way more than satisfied. Try mint chocolate chip ice cream on chocolate chocolate cookie- it was bliss. Also enjoy sitting outside and watch the foot traffic. Mill never disappoints with fascinating people watching.",review,0,3VIRjR2V29TOaI9u64hMig
179326,FALSE,Sushi Bars; American (New); Restaurants,Gilbert,"2224 E Williams Field Rd
Gilbert, AZ 85295",6qC2ATU4rVRRTKI-SScQOQ,33.306896,-111.752395,Kona Grill,NA,TRUE,66,3.5,AZ,business,0,5/12/2012,0,DrdxONy56RbyuC7_bFehTw,3.29,FALSE,1,1,Valery,7,user,4,5,"I really love this place!  They have really good sushi and the best Onion Soy salad dressing ever! The service could be better, I usually sit on the patio and there is one girl who is a waitress there who pretty much doesn't smile and is short when she comes to the table to wait on you but other then that I can't think of anything else that I would be able find as a con to this restaurant...I wont knock them a star due to this one girl...I love the place and they deserve the 5 star rating!",review,1,ISZXU3ZxqbCT0opbtMsb8w
54494,FALSE,Shopping; Office Equipment,Phoenix,"106 W Osborn Road
Phoenix, AZ 85013",0jPDeGGcCjX2BXj0DEuWIQ,33.4876227,-112.075086,Staples,NA,TRUE,6,2,AZ,business,0,7/26/2012,0,8hrexgGy3SxQJ1IUOp2JaA,4.11,FALSE,2,3,Mark,18,user,6,3,"Nothing great about this place. Sometimes they have too many employees following you around like a puppy, Sometimes they are short. Today they were just plain unpleasant. No thank you. No apology for their rewards system not working - just a ""you might want to call the number on the card."" On top of that, they have some ridiculous card you can buy for 10 dollars, but you get a coupon for 5 dollars, then you get 15% off. Hey guys, don't make it complicated  -just give us a reasonable price and stop stroking us it on ridculous reward systems. BTW Staples brand product sort of suck. So what I'm saying is... if you live in the area and need a pen, go for it. Just don't your hopes up for any more than that.",review,0,X1nTlg9in3_Ch8QR8Hx4lg
167181,FALSE,Women's Clothing; Thrift Stores; Shopping; Fashion; Accessories,Glendale,"7530 W Bell Rd
Ste 105
Glendale, AZ 85308",kBboKZCqHsXOO8ooLeMJYA,33.639638,-112.220869,Plato's Closet,NA,TRUE,5,4.5,AZ,business,0,10/16/2012,0,nt8P0pB56hFeOuHpu2bqnA,5,FALSE,0,1,David,4,user,2,5,Highly  think  this  is  a  great  place  for  buying  clothes  at  a  very  reasonable  cost.,review,1,BuxGraZ7iB_nqV2vDFLa-A
121114,FALSE,Mexican; Restaurants,Phoenix,"401 W Clarendon Ave
Phoenix, AZ 85013",#NAME?,33.49112,-112.079081,Gallo Blanco Cafe,NA,TRUE,549,4,AZ,business,0,10/4/2010,0,9_476pvXueFI4VI_amqpCg,0,TRUE,0,0,NA,0,user,0,2,"I am not sure what is going on here but Doug is letting this place slip up.  I have been an advocate of Gallo since it opened and have recommended it to many people but the last few times I've been here it has been very sub par.  I figured it was just a fluke but its happened a few times in a row now and I am obligated to update my review.

The last time I was in I ordered guacamole, a shrimp taco, cochinita taco, and a carne asada burrito.  The avacados in the gaucamole were rock hard.  For Doug's love for fresh and local food this is absolutely unacceptable.  When I bit into my cochinita taco it had two huge pieces of fat I had to spit out on my plate.  Disgusting.  The shrimp was cold and overcooked in my 3 dollar shrimp taco.  The carne asada burrito may have the best marinated carne in all of town.  But when they charge 8 dollars for it (twice the price of almost everywhere) and then fill it half up with beans this is also unacceptable.  My bill along with my dates came out to 40 bucks without drinks.  I am finding it very hard to spend that kind of dough for this kind of experience.  

All good things must come to an end I suppose.  I may be back someday.  But I will never recommend it again unless things change dramatically.  It actually saddens me to have to have written this.  I hope things go back to how they were.",review,4,SGXahHRReksq3m_Zk9V20w
48601,FALSE,Breakfast & Brunch; American (New); Cafes; Restaurants,Scottsdale,"4151 N Marshall Way
Scottsdale, AZ 85251",qKBdXH1kZNU-c9BHQaTUag,33.49618149,-111.9288101,Dottie's True Blue Cafe,NA,TRUE,36,3.5,AZ,business,0,3/9/2012,1,RA33d3bj62fWilOzU1g9WA,5,FALSE,0,1,Kirsten,2,user,1,5,"I have been to the original Dottie's in San Francisco several times, which everybody knows is _the_ place downtown to eat breakfast. Yeah, they have LINES around the block every day, which, with all of SF's snobby eaters, that's saying a lot. Naturally, my group was skeptical, because we LOVE the original. So, we ordered a few of their classic signature breakfast dishes, including the black bean cakes with cornbread (this one was on Diners Drive-ins and Dives)  and the Alabama Summer (fresh fruit, with either amazing pancakes or to-die-for french toast). We were not disappointed. The food was the usual big portions and perfectly cooked. I was shocked -- they really did stay 'True Blue' to the original. I'm thrilled I finally don't have to go 1,000 miles for those disgustingly good baked goods I usually stuff in my bag on the plane ride home. Keep it up, Dottie's clone!",review,0,pYytP4YBySaUnAhA4AKa5A
207378,FALSE,Hair Salons; Beauty & Spas,Surprise,"13794 W Waddell Rd
Surprise, AZ 85379",pyU4pTX19Rkbb23CG_tA5Q,33.6093014,-112.3560476,Great Clips,NA,TRUE,8,4,AZ,business,0,2/3/2009,0,t8O29hmyCeXmZ393IVDa2A,3.11,FALSE,15,7,lysser,19,user,29,3,"Since I can't manage to schedule an eye exam once a year much less a haircut every month or two (or four), Great Clips is my kind of place.  Sure, I have to sit in a hard plastic chair, squished between scraggly-headed kids and a guy with a farmer's tan while I wait, but it's not that bad.  Over the last 3 years, I've had a few killer haircuts and a handful of really bad ones, but no biggie.  It's just hair.",review,0,2BUJA0Y7ktr9vL_37ss8gQ
200966,FALSE,Wine Bars; Bars; Restaurants; Nightlife; Tapas/Small Plates,Scottsdale,"7137 E Stetson Dr
Scottsdale, AZ 85251",P5uC-zfGG6yqoQDUyqyAvg,33.4995106,-111.9272212,Kazimierz World Wine Bar,NA,TRUE,245,4,AZ,business,2,9/8/2010,1,VIVUjAhdFNHdQ-yfKVLEIQ,3.72,FALSE,322,331,Jason,376,user,1034,3,"Kazimierz = 

* Awesome ambiance and decor
* Extensive wine (it is HUGE and takes me forever to pick something)
*Comfortable seating (I LOVE the couches)

This really is a great place when it isn't busy.  I love coming here to chill and try a few glasses of wine.

And I really want to give this place 5 stars but I just can't.....

I really like this place, but I HATE it that they charged a cover Sunday night.  It really pisses me off.  I don't care if they have live music.  They already overcharge for everything so you'd think they can kick in a few bucks for the band instead of pissing me off?  I don't care about the $5 - it is the principal of having to pay it while the douche at the door lets other douches in for nothing.  I guess I have just come to expect certain places are above charging a cover but I guess not.",review,0,rLtl8ZkDX5vH5nAx9C3q5Q
126947,FALSE,Nightlife; Bars; American (Traditional); Sports Bars; Restaurants,Phoenix,"Sky Harbor International Airport
Terminal 4, C Gates
Phoenix, AZ 85034",VFjeCLwVMguUNWH-DeOgyw,33.43468252,-111.9944036,Fox News Sky Box,NA,TRUE,30,2.5,AZ,business,0,11/28/2010,0,hpRltvhiWJNQHRMG-P2muA,3.3,FALSE,115,83,Joe,567,user,416,1,"If there weren't tv's, chairs, and tables, this place would get one star...

The food is beyond awful.. t really is.. Seems like the burger was microwaved...

The prices are a joke for what you get...

I understand it is in an airport, but give me a break.

The service was the worst of all.... It seemed like the waitress was annoyed when we asked for the price of drinks because it wasn't listed on the menu...

We won't be back...

Garbage place...",review,1,4BZbyy12azmRsZErsiTWwQ
