id,business_blank,business_categories,business_city,business_full_address,business_id,business_latitude,business_longitude,business_name,business_neighborhoods,business_open,business_review_count,business_stars,business_state,business_type,cool,date,funny,review_id,reviewer_average_stars,reviewer_blank,reviewer_cool,reviewer_funny,reviewer_name,reviewer_review_count,reviewer_type,reviewer_useful,stars,text,type,useful,user_id
132783,FALSE,American (Traditional); Restaurants,Gilbert,"3000 E Ray Rd
Bldg 1
Gilbert, AZ 85296",QnAzW6KMSciUcuJ20oI3Bw,33.32106164,-111.7239189,Joe's Farm Grill,NA,TRUE,525,4,AZ,business,0,4/25/2011,0,137qVr9-dVMZVpRG0y_hxg,3.82,FALSE,38,32,L,150,user,176,4,"We came to Joe's for a quick snack/lunch.  We anticipated eating a big dinner so we didn't order much.  We just had an order of onion rings and the chili cheese fries.

Onion rings - hella crispy, not soggy, had a good taste. 
Chili Cheese Fries - chili was really good and when well with the fries. 

Ambiance - love all of the outdoor seating and all of the glass kinda makes you feel like you are outside.

I'd come back again so I can try some real food and the Coffee Shop next door.",review,1,emb_C0VedxgAqVvq2ulq0w
160514,FALSE,Arts & Entertainment; Performing Arts,Phoenix,"502 W Roosevelt St
Phoenix, AZ 85003",3byBKds6zEJ6zCDh90bhVg,33.458956,-112.080452,Arizona Theatre Company,NA,TRUE,28,4.5,AZ,business,7,11/15/2008,1,Bt5IsLrp7Yg85G26YW3tmQ,4,FALSE,354,170,Marian,57,user,389,4,"It has been a long time since I attended a play. I am glad I chose Arizona Theatre Company's production of  ""The Lady with All the Answers"" that previewed on Thursday evening at the Herberger. Growing up on the South Side of Chicago reading the Sun Times and catching Ann Landers' column is embedded in my memory banks. 

This was my first visit to the Herberger Theater and it is a great place to see a show! The sets, sound and lighting enhanced the experience. Nancy Doussault gave a dynamic portrayal of Ann Landers struggle to write a column. I'm looking forward to seeing the upcoming performance of Hair.",review,9,XT0zTD3ZgpUzgD4KJb3yfg
133466,FALSE,Barbers; Beauty & Spas,Tempe,"905 E Lemon St
Tempe, AZ 85281",d73gYu52C-Wt24RAGUy9Ow,33.4168391,-111.9261446,Ray's Asu Barber Shop,NA,TRUE,6,4,AZ,business,0,11/4/2011,0,gksiMUf4fK5WhuzVDT6-Qg,3.63,FALSE,28,28,R,97,user,157,5,"I've been a customer of Ray's since my freshman year at ASU, 1983. I make it a point to try and get to Ray's whenever I'm in town, and I always leave w/ a great haircut and a smile. 

PROS: old school attitude; friendly customers; reasonable price; Charles, Jerry, and my favorite barber of all time, Lloyd

CONS: more ESPN, less Modern Marvels (ha ha)

Ray's has a home town feel, and why wouldn't they? They are an ASU staple. I'm guessing they have taken care of damn near every ROTC cadet for the last 4 decades . . . Thanks guys!

Rich",review,1,IRAAra0N-Hu-betcWCKpgw
129844,FALSE,Vegetarian; American (New); Restaurants,Phoenix,"21001 N Tatum Blvd
Phoenix, AZ 85050",8cL7aJVKTYmLguzXEAS3Lw,33.678615,-111.9746066,Yard House,NA,TRUE,128,3.5,AZ,business,0,1/7/2012,0,Ys4Gwi0m_hAvq4vaYwchuw,3.88,FALSE,253,182,Erika,566,user,478,3,"It's fine, it's a Yard House. 

Service is fine, food is fine and the beer's on tap are cold.",review,0,fTo1Nf5hXSZqPC_qkvXlrg
99259,FALSE,Dive Bars; Bars; Nightlife,Scottsdale,"7011 E Indian School Rd
Scottsdale, AZ 85251",cjjZt2oOkk0F152RkQMfQw,33.4946362,-111.9299092,Coach House,NA,TRUE,114,4,AZ,business,5,11/15/2007,1,eTj0tfA9ulL-32htjcKqNg,3.73,FALSE,686,317,Melissa,418,user,971,5,"We decided to check out Coach House last night for a few drinks to celebrate my husband's 27th birthday. We love dive to slighty dive-ish bars as they usually have cheap drinks, interesting character and personality, and a good jukebox.  Coach House fits all three of those criteria. 

The bartenders were extremely friendly and chit-chatted with us a bit. The clientele is quite mixed, but it was great to see tons of people singing along to the jukebox without a care in the world. Someone definitely loaded up on the Michael Jackson selections that the jukebox offers, as we heard a couple of MJ songs from back in the day (you know, when he was black and had a nose). 

It definitely looks like Christmas threw up inside Coach House, but it gives it character and personality, which I appreciate. I know I will definitely be back to Coach House because any bar that opens at 6 am gets an A in my book!",review,3,jqVeTSin5GeRm0ceSg-PBA
101422,FALSE,Mexican; Restaurants,Phoenix,"401 W Clarendon Ave
Phoenix, AZ 85013",#NAME?,33.49112,-112.079081,Gallo Blanco Cafe,NA,TRUE,549,4,AZ,business,0,1/16/2012,0,NUXN9KUn8QYHAdG0C2NxIw,3.78,FALSE,11,5,Shannon,58,user,39,3,"I like the Clarendon a lot. There's a rooftop bar, a really awesome pool, a cool feel to it, a lounge, and they have events that seem fun. My friends and I come here for lunch from time to time, and I've been in the evening a few times  as well. 

The bar service is Ok depending on the night in which you go. I've gone a lot of Saturday nights and had great service most of the time, although there was one night the service was incredibly slow.  I like the drinks and have eaten in the cafe just a few times. The dishes I've ordered are just OK, nothin' special. The fruit salad had a lot of apples and very few strawberries (yes I know apples are cheaper).  I had recently ordered a crepes dish that was supposed to have a specific cream sauce with plantains. I was disappointed to see that the crepes were covered with cheap-o spray can whipped cream and bananas! Not the same. I was craving some plantains.  The guac is OK with greasy chips, but I've had better restaurant guac. I typically enjoy a sangria or a wine.   One of the people in my group had ordered a drink and said it sucked, though. 

I like the ambience of the place, mainly because I am usually with a large group of friends. It can get loud during certain evenings. I used to come a lot of Tues evenings but haven't been a while.  Saturdays can get busy, as expected, but the lounge is a chill area to hang out while waiting for a table, and the wait staff leave us alone till the table is ready. 

I love the rooftop bar area, especially during the cooler months. Sometimes the heat lamps aren't on, though. It's open late, and it's usually not busy.",review,0,RyzzI97Vq4IelbSp5wwGtg
58485,FALSE,Pizza; Restaurants,Fountain Hls,"12645 N Saguaro Blv
Ste 16
Fountain Hls, AZ 85268",vN4mFODLd-gLmDg261wsyw,33.6005624,-111.7163108,Euro Pizza Cafe,NA,TRUE,28,3.5,AZ,business,0,8/22/2012,0,l_VcaD8JCArqasdGhcrJKw,3.58,FALSE,258,267,Ed,342,user,338,3,"Their pizza is really good, but seem to have trouble with phone-in orders if you order more than a few items. We ordered several items for a company lunch a while ago, had to go back to get missing items.     Still recommend for the pizza!",review,0,EcgpGtxB5916NPqvXwMcjQ
139559,FALSE,Mexican; Restaurants,Phoenix,"2502 E Camelback Rd
Phoenix, AZ 85016",_-9pMxBWtG_x8l4rHWBasg,33.5102068,-112.0272041,Black Chile Mexican Grill,NA,FALSE,98,3.5,AZ,business,0,12/30/2011,0,K9bUXAe0r6_Z1rHaMLDCxQ,4,FALSE,4,3,Annie,7,user,8,3,"I was pretty hopeful about this place but was a little disappointed. It was good but not great. It was a good place to take my parent but I won't come back. 

Dislikes: The dishes are not very creative. Lots of meat and no veggies. Food was too rich, no light options on menu. Salsa was plain. Salmon was a bit fishy

Likes: the sangria was fizzy which was fun, elote corn was very tasty, beans and rice were tasty and well seasoned",review,0,kacOkLRg_lcNA_wPE4bb1Q
226255,FALSE,Steakhouses; Restaurants; Brazilian,Scottsdale,"6300 N Scottsdale Rd
Scottsdale, AZ 85253",OE5nAmaSVaopeRS1Cs9Kuw,33.5299053,-111.926437,Fogo de Chao,NA,TRUE,222,4,AZ,business,1,10/30/2011,0,g8nCD3bUyfNphvtwmOLXuA,4.02,FALSE,3,4,James,56,user,24,5,if u can afford this food than you know why most people have given this place five stars i also went to the one in Austin Texas OMG!! sooo good i will and have already returned to this place many times,review,0,u-IdKmC7u9AFlypEPi_16g
2450,FALSE,Mexican; Restaurants,Phoenix,"455 N 3rd St
Phoenix, AZ 85004",#NAME?,33.4527955,-112.0693177,Mi Amigo's Mexican Grill,NA,TRUE,53,3,AZ,business,3,10/10/2010,2,d1CvzllHCEC0GoZohwgD3w,3.94,FALSE,2093,1852,Amy,325,user,2375,2,"I started a new job and the bosses brought us here for lunch.  It was ok.  I got a lunch combo meal, but I didn't pay.
The service was really great but the food was not.  Just kind of plain.  
It's convenient to work, so I will probably be back, I just won't have very high expectations.",review,6,6kmu0mYbdpMIOZ6Y0eVsxg
154937,FALSE,Food; Desserts; Coffee & Tea; Shaved Ice,Mesa,"2235 S Power Rd
Mesa, AZ 85209",lw74h6AbGU-zeOYpAe56PA,33.375057,-111.687177,Bahama Bucks,NA,TRUE,5,4,AZ,business,1,3/8/2011,0,roqjiM1OPv0p0w9JdEDFRg,4.09,FALSE,35,35,Heather,58,user,106,5,"It's been ages since I've been to a Bahama Bucks! I really love this place, they have the best shaved ice and just about a gazillion flavors (even pickle juice folks, seriously). And what can be better than a delicious shaved ice in the valley of the sun??? 

They also have great smoothies and other treats, and I just saw today that they do 1/2 price sodas from 2-5PM each afternoon. I wanna go back and try the Caribbean soda, it sounded lip smacking good.

My last tip: splurge for the cream on top of your shaved ice. It's 50 cents of pure heaven...",review,0,038fcAUG3makrkLXRgw52g
184997,FALSE,Nightlife; Bars; American (Traditional); Sports Bars; Restaurants,Phoenix,"1904 E Camelback Rd
Phoenix, AZ 85016",CqhsIZ7TzCfJTrZqg5-gqQ,33.5093736,-112.0409502,The Armadillo Grill,NA,TRUE,102,4,AZ,business,4,6/17/2009,9,aPKY7CiNSuo7TdkooPYv7g,3.62,FALSE,474,446,Kerstin,149,user,645,4,"Really? Seriously? Sarah L. is the L for Little Pompous? Where is your hood, North Snottsdale? Unbelievable. How can you review a restaurant you didn't even eat at??? from your review you just walked in had a beer, peered down your nose and left. 

This is a great little spot tucked away unsuspectingly on Camelback road. They have a great happy hour, pool tables and a surprisingly great menu. I haven't been here in awhile because of the economy the way that it is. But they did have off track betting as well . Not sure if they still do. 
The service is good the people are fun and friendly. I like bar food but you can get so much more here. 

Some of my Fav's 
The herb crusted beef tenderloin is outstanding great cut of meat cooked to perfection. 
The Mediterranean stuffed chicken stuffed with artichokes, black olives and feta with a dill sauce and wild rice it is delish! 
I am not a big fan of Pesto but their Penne pesto cream is yummy. 
Also try the Thai Chicken skewers, Artichoke Croquettes, Louisiana Shrimp, or the Cracked Black pepper Calamari! 

This is a restaurant/bar! It's a joint, a neighborhood hang out. 

I hate to be rude but geez, you stick to your hood and I'll stick to mine. When you offer a review in the future you should start by saying I rarely go anywhere that doesn't require a 20.00 cover and has a coat check.",review,6,_7el1cOgnfkNfmZKi277bQ
24813,FALSE,Vietnamese; Restaurants,Phoenix,"4538 N 19th Ave
Phoenix, AZ 85015",Zy2vca7i9QFGRKa4m0C__A,33.5030185,-112.0999,Da Vàng,NA,TRUE,170,4,AZ,business,1,2/12/2012,0,lvs4LPe_wGNGSgs_itfguw,3.69,FALSE,4,1,Nicholas,16,user,22,5,"We ordered the following for breakfast:
Ban Xeo (Pan-fried flour crepe with shrimp, pork, and bamboo shoots)
Banh Mi Trung Rang (French bread sandwich with fried egg omelette)
Chao Thap Cam (Rice porridge with shrimp, pork, squid, fish ball, and imitation crab)

The Good News:
This is one of my favorite places to eat, I have become a regular here, and it is the best Vietnamese restaurant I have been to thus far in southern Arizona.
All of the entrees are always freshly and properly prepared.
The service is quick and about as friendly as it gets for a Vietnamese restaurant and the prices cannot be beat.
The crepe was cooked perfectly as was the meat and veggies inside, all of which were very tasty, and the serving size was plenty for two people.
The French bread was fresh, light, and flavorful, the egg was cooked just right for a sandwich like this, and the veggie toppings(carrots, onions, cucumber, and jalapenos) were a perfect accompaniment. My dining companion had originally decided against having a sandwich, but once she saw how much I was enjoying it she joined in and ate the other half.
The consistency of the rice porridge was just right (not too heavy or watery), there was ample portions of pork and all of the different seafood, and the serving size was plenty for two people.

The Rest of the Story:
The place is a bit run down outside and there always seems to be the usual suspect hanging out in front, but don't let that deter you.

The Verdict:
I make sure to eat here at least once or twice a month and will continue to happily do so.",review,2,6mre9Wbn3QIBXzh3OeLEeQ
50249,FALSE,Mexican; Restaurants,Chandler,"71 E Chandler Blvd
Chandler, AZ 85225",T_Kcz_bkhE9T6YejqFqPxQ,33.3060217,-111.8404958,Guedo's Cantina Grille,NA,TRUE,57,3.5,AZ,business,0,4/3/2007,0,6ySXu5KU0MIBpCR2H_ijsQ,4.08,FALSE,72,43,Andrew,163,user,136,4,I love the fish tacos.,review,1,FLdun6KWwAh-gC8VHVZGCw
54576,FALSE,Bars; Nightlife; Karaoke,Phoenix,"3738 E Thomas Rd
Phoenix, AZ 85018",RIeWXLMHZQlYprYt1x2f1w,33.480716,-112.000164,Ole Brass Rail,NA,TRUE,27,3.5,AZ,business,0,3/31/2010,0,p1yoWvUY5QjfTeBBoLJung,2.89,FALSE,86,62,Brenda,148,user,197,2,"I went in for the cheap breakfast for the first time at noon today. I had the $3 plate. It was okay. My toast was perfect & buttery. I was going to have the $4.75 plate with french toast until I learned it came with one slice of toast! That was very disappointing to learn the price jumps a $1.75 and you get only one slice of dipped toast but could get two pancakes, it doesn't make sense. I wonder how big and fluffy the pancakes are, but not enough to risk it and order them. I just don't get it, why they think one slice of french toast is a fair deal. 
Anyhow the eggs and bacon came with that, they were cooked okay. Could have done a more presentable delivery of the meal at home. Have seen a more presentable job done at many other eateries through out the USA at independently owned or chain restaurants. So I'm in no rush to return here for the breakfast, even if it is cheap. Unlike some I won't be abandoning other long standing breakfast joints for this. After all you get what you pay for. And i prefer my breakfast in a sunny and brighter place as well verses a dark drab bar, but to each their own choice.",review,1,-9mljS0O9mwdOnGv-Oea3Q
132410,FALSE,Tapas/Small Plates; Spanish; Restaurants,Scottsdale,"7217 E 1st St
Scottsdale, AZ 85251",sjCRI-lCh4KLO_RYQdlEeQ,33.4920804,-111.9255527,Iruna,NA,FALSE,95,3.5,AZ,business,7,10/4/2010,5,KFnKQ4MglvzWlmTS031VFQ,3.58,FALSE,6353,6230,Jim,1325,user,8001,2,"So here's the scenario:

A foodie website with lots of citizen reviewers is holding an event at your restaurant.  You go in knowing the people at the event will in all likelihood write reviews of your restaurant.

Do you:

A. Treat the attendees as if you are doing them a favor, run out of food early and generally put out the feeling that you would like the whole ordeal to be over as fast as possible so you can get these folks out of your establishment.

B. Seize the opportunity to put your best foot forward and capitalize on the opportunity to present your great food and friendly, professional staff to the reviewing community, in the hopes of receiving praise and business in return.

If you chose B you do not run Iruna.

To be honest, I am not privy to the negotiations and such that go on between Yelp and a restaurant hosting an event.  I do however have a solid grasp of business and marketing.

In my opinion, Iruna's behavior at the recent Yelp event reflected answer A above rather than B.  It was unfortunate.  

The food varied from good to mediocre.  I heard some folks got more than a few morsels, I'm not sure who they were.

I experienced attitude from staff members myself and witnessed a number of other people receive the same.  I was frankly quite surprised.  It was clear to me the staff did not grasp the opportunity they were presented with and viewed the event as a problem to get through.

As a contrast, I attended a Yelp event at The Breakfast Joynt over a year ago. The staff and management was pleasant and welcoming and the food was very good.  I have returned to The Breakfast Joynt 6-7 times since the event.

I won't be back to Iruna.",review,13,P2kVk4cIWyK4e4h14RhK-Q
172645,FALSE,Pubs; Bars; Nightlife; Irish; Restaurants,Tempe,"401 S Mill Ave
Tempe, AZ 85281",L2J3JfjXZLnX1rLhWKthqA,33.426368,-111.9398551,Rula Bula,NA,TRUE,238,3.5,AZ,business,0,3/15/2010,0,1Z4NrBQqw6rTkmM20BdIeA,3.41,FALSE,0,2,Andrew,17,user,7,5,"Wicked tasty shepherds pie, friendly staff and nice environment. Thanks for the great recommendation Yelpers (I was visiting on business).",review,0,iimydw__Zr7DUZGFrTxOLg
218716,FALSE,American (New); Restaurants,Phoenix,"2337 N 7th St
Phoenix, AZ 85006",M6fjHpkL9IRI-nI0BattRw,33.474605,-112.065107,The Main Ingredient Ale House And Café,NA,TRUE,238,4,AZ,business,0,2/15/2010,0,UedfziIw-pwPTyKOCqkRzQ,2.67,FALSE,0,0,Kristy,3,user,1,5,"I heard good things about the Main Ingredient and decided to check it out for a Friday happy hour.  Drinks were half off until 6, which was nice.  I was not sure what to expect, since I don't always have the best of luck when I go to places that are newly opened.  This place went beyond my expectations, especially with the food.  We started with the antipasto plate, which was great.  We decided to stick around for dinner.  The sandwiches were amazing, especially the roast beef.  I would definitely go back.",review,0,yPejZVwY1lvehq28pEGgpA
171678,FALSE,Chicken Wings; Restaurants,Chandler,"5905 W Chandler Blvd
Chandler, AZ 85226",E1Pbi0RWfaeAaRXjBIX8Aw,33.3051209,-111.9434616,Wingstop,NA,TRUE,13,3,AZ,business,1,4/15/2011,0,Umt9lJC4ZV0QZpuzSxtZTw,3.87,FALSE,7,18,Mark,39,user,46,5,"Some of these reviews kill me.  People go to a wing place and order chicken strips, or get some random sauce they didn't like and blame the restaurant.   

Now for what to expect:  I never have/will order anything but a chicken wing from this place and I'd recommend you don't go here unless you want a chicken wing.  Also, it is more setup for a smaller lunch/dinner crowd and I imagine they get most of their business from take out orders.  Lastly, they cook the wings to order which take 15 minutes to prepare.  'Nuff said.

Now I have 3 reasons I love this place.  First, their wings are cooked to perfection.  They are juicy and cooked just enough to have that perfect crispness one should except from a chicken wing.  I've never had them screw it up the many times I've been there.  Second, their fries are delicious.  They remind me of boardwalk fries which you don't get around here much and they put what I think is a salt/sugar seasoning on them which is excellent.  Last but not least is their sauces.  While oddly bright red their regular hot flavor is well done.  The garlic parm is simple and delicious.  And my favorite and the most unique is lemon pepper.  It is oddly tangy and I can't figure out how they do it.

They aren't cheap but I think you get your money's worth.",review,5,m9Kl_CB5K5Zlmn1aNAFl3w
108621,FALSE,Japanese; Restaurants,Phoenix,"2815 N Central Avenue
Phoenix, AZ 85004",oSKT5oZX1NWYaHwOWL5lag,33.4793963,-112.0736133,Ichi Ban Japanese Restaurant & Sushi,NA,TRUE,30,3,AZ,business,0,6/8/2009,0,d5sIl7IcPyFa7K1JV-wh6A,3.75,FALSE,3,1,David,4,user,6,4,"The closest good sushi you'll find downtown. I've been going to Ichi Ban for a couple of years and have to say that its the best sushi you can find in downtown. They have a lot of specialty rolls such as the phoenix suns roll, spicy Tuna with unagi on the top with dressing. Pretty tasty. Their sashimi is fresh and made to order. The only bad thing about this restaurant is when your eating and it's not busy, they seem to be spying on you and makes it a lil uncomfortable for  you peeps that can't stand that the staff is looking at your every move. For me, I just want goo sushi and this place definitely hits the spot.",review,1,IlCeN--3_-AzWxNZgZco2w
108074,FALSE,Breakfast & Brunch; Restaurants,Glendale,"4915 W Glendale Ave
Glendale, AZ 85301",oB3LAXzg-GgnPbBRUsvxxw,33.5383534,-112.1658193,Kiss the Cook Restaurant,NA,TRUE,49,3.5,AZ,business,0,7/12/2012,0,1U_ycXQvHW4NZoIrriGsZA,3.5,FALSE,0,1,Rachel,8,user,14,5,EXCELLENT and known for their PANCAKES!! Amazing! All breakfast items are very good including their omelettes. Don't go to a restaurant that specializes in breakfast and expect their lunch to be good. Went there one time for lunch and would've rather had a sandwich from a hospital cafeteria. Eight years of going there for breakfast. Great price and serving sizes.,review,1,WCo_Cv6dBsTgQF-6NH8iig
107578,FALSE,Wine Bars; Bars; Nightlife,Scottsdale,"20751 N Pima Rd
Ste 120
Scottsdale, AZ 85255",YQ19y3LYgmAHfgNFa01vyA,33.6721048,-111.8904868,Armitage Wine Lounge & Cafe,NA,TRUE,52,3.5,AZ,business,0,2/9/2011,0,8o6jD6AnPLbIbzmN7EpkYg,3.7,FALSE,2,2,John,20,user,3,4,Nice quaint little wine bar. Decent prices.,review,0,U-Yla9Hcf94-STbwmZuAAQ
184357,FALSE,Bars; Mediterranean; Nightlife; Lounges; American (New); Restaurants,Phoenix,"3815 N Central Ave
Phoenix, AZ 85012",EWMwV5V9BxNs_U6nNVMeqw,33.491645,-112.073196,FEZ,NA,TRUE,652,4,AZ,business,3,1/2/2010,0,Gfe9S210ji4Nw46theTUbA,3.9,FALSE,491,396,Tina,320,user,767,4,"I have only been to FEZ 3-4 times but I am cuh-razy for their rosemary fries and their bread plate with the pesto dip, tomato sauce, and something else I can't recall. My favorite thing to drink there is the pomegranate margarita...that one drink kicks my ass every time. I love the atmosphere and it is always pretty happening with a diverse group of people.",review,3,RxfFQxUtSIGYwTKU_rvAeg
25451,FALSE,Bars; Music Venues; Arts & Entertainment; Nightlife; American (New); Sports Bars; Restaurants,Tempe,"2433 E University Dr
Tempe, AZ 85281",5BXNeSwzOy1nhU9PtCHvIw,33.4220858,-111.8866946,Stray Cat Bar & Grill,NA,TRUE,28,3.5,AZ,business,0,9/22/2010,0,xovdLhYdpp6hqrpzXXf5Zg,4.2,FALSE,1,0,Kayleen,5,user,5,3,"Very much a dive bar, but comfortable. Not typically my scene, but they do offer (through outside source) free learn-to-play-craps tournaments on Monday nights.  Its fun and the winners usually get little freebies such as a gift card to the bar.  Fun for a last minute drink on a weekday after work.",review,0,O7xufJ-uO93XJR-IL_Wsqw
207789,FALSE,Greek; Mediterranean; Middle Eastern; Restaurants,Chandler,"2580 W Chandler Blvd
Ste 3
Chandler, AZ 85224",7-vGQpfj0RcOD-Cy7CXDiA,33.306806,-111.88557,Pita Heaven,NA,TRUE,30,3.5,AZ,business,0,6/10/2012,1,HXSEEf9Wrip2fQCvPRd-wg,2.2,FALSE,4,3,Icabod,13,user,23,1,"First things first, they are not Greek. Ok I too have given this place more than one chance. First visit was ok. Met the owner and was excited they were there. I work in the area. 

Second visit I encouraged other employees to try the food. I called and asked if we could give them our order the day before so it would be ready before lunch crowd. No?. One of the rude girls there said no you have to call the day of the pick up? So we called in our orders all nine of them as soon as they opened. When we got there we had to stand in line with people who were placing orders-12 of them. Ok our food sat there for over 30 minutes that we knew of.

Friday evening at 7:55 I called and asked what time they closed and one of those girls told me 9:00pm.  I drove 12 miles back to the area. When I arrived at 8:45 pm, I assume the same girl I had spoken with earlier said we decided to close early tonight. Thats enough for me.  The owner needs to send his girls to charm school and they need to know customers aren't coming in because of them.",review,5,LiBiG6G_5visF_kGdzrrHw
141760,FALSE,Caterers; Pizza; Event Planning & Services; Restaurants,Scottsdale,"6989 N Hayden Rd
Ste 9
Scottsdale, AZ 85250",kK4AzZ0YWI-U2G-paAL7Fg,33.5381023,-111.9085317,Crust Pizza & Wine Cafe,NA,TRUE,93,4,AZ,business,0,3/1/2010,0,EH52BOTD_DxUvcuq5ZUONQ,3.71,FALSE,76,26,Sharon,136,user,145,4,Have been enjoying Crust since it opened about 2 years ago. The pizza is very good!! Comes in a cute eiffel tower shape. The deserts are awesome and you can take them to go!! The wine selection is pretty small but they are choice bottles without being overpriced! The owners are very laid back but its a fun little small place.,review,0,3hPmlMAP3PfHMiwNW_RUZg
