id,business_blank,business_categories,business_city,business_full_address,business_id,business_latitude,business_longitude,business_name,business_neighborhoods,business_open,business_review_count,business_stars,business_state,business_type,cool,date,funny,review_id,reviewer_average_stars,reviewer_blank,reviewer_cool,reviewer_funny,reviewer_name,reviewer_review_count,reviewer_type,reviewer_useful,stars,text,type,useful,user_id
158996,FALSE,Indian; Pakistani; Restaurants,Tempe,"1212 E Apache Blvd
Tempe, AZ 85281",x3ws2L-TlI-JPcEQjjEC9g,33.415194,-111.919995,Curry Corner,NA,TRUE,44,4.5,AZ,business,0,4/13/2012,0,9bN1zHL3WOS_20jnNJ2mmA,4.67,FALSE,0,0,Christine,3,user,1,5,"I had such a great experience at the Curry Corner tonight! I was really hungry, and showed up 20 minutes before closing (I was that customer, I know), but surprisingly they were completely welcoming and accommodating! I never felt rushed or like I was inconveniencing them at all.The food was awesome too! I got the Vegetable Thali which came with several different curried vegetable dishes, rice, naan, amazing pickled onion, and raita.I was very impressed with this place, and will definitely be back!",review,0,FgXvm5wefv-oHzuQP_Ks6A
5945,FALSE,Wine Bars; Bars; American (New); Nightlife; Restaurants,Phoenix,"2603 N Central Ave
Phoenix, AZ 85004",IVc23uY-36WUNYoIbz42Fg,33.4770236,-112.073629,Switch Restaurant & Wine Bar,NA,TRUE,343,4,AZ,business,0,3/22/2012,0,a0n3pnYyVb_7z_xncoI7rQ,3.62,FALSE,35,23,Allison,32,user,42,4,"I went here for happy hour with a long time friend. I wanted to try something new and Switch totally fit the bill.

First off, their happy hour is A-mazing! I had two glasses of white sangria that were just perfect. 

My friend and I shared the cheese and fruit plate because it was on special. It was nice to try everything, and since it was on special it made everything taste better.

For my meal I had your traditional cheeseburger, and it was very good. I had half to take home which made for an excellent lunch the next day. 

The only thing about the place that was a little strange was the crowd. I expected for having such an awesome happy hour it would be busier, however it was kind of dead. I even saw a group of people be seated and abruptly leave. It was kind of strange. Perhaps it was just an off night. This is definitely a place I would go to again!",review,1,QQltfvEq-YYN7roLQarVsg
140842,FALSE,Chinese; Restaurants,Phoenix,"4232 E Chandler Blvd
Ste 4
Phoenix, AZ 85048",EWnSPExh_T5zTv6oMJOC5g,33.305824,-111.991311,Mr Chao's Asian Bistro,NA,TRUE,29,3.5,AZ,business,0,2/20/2010,0,sYiQlAvoLCHcs10GhlMJTg,3.47,FALSE,247,268,Eugene,156,user,371,3,"No, not impressed. Quite expensive too. Good thing it was not greasy, bad thing it was not interesting. Probably aint gonna come back.",review,0,vWCksqJJfYjGGdD-yb9qGA
29383,FALSE,Mexican; Restaurants,Anthem,"39510 N Daisy Mountain Rd
Ste 170
Anthem, AZ 85086",uPDTnuR-sOi47blHH943lg,33.844328,-112.133957,Roberto's Authentic Mexican Food,NA,TRUE,65,4,AZ,business,0,12/16/2012,0,X64ZbIT5jMvicC9EVfuZUg,5,FALSE,0,0,Amy,3,user,0,5,Great people and even better food!,review,0,KIfrNLjmMfJ4DKurBQmdlw
46361,FALSE,Event Planning & Services; Party & Event Planning,Phoenix,"12014 N 32nd St
Phoenix, AZ 85028",f_leeIRar8uNCkk5sAmHRQ,33.5959956,-112.0133447,Blooze,NA,TRUE,20,4,AZ,business,5,2/8/2009,5,VA5Rp-Pq6FmDT23lZ93bRA,3.77,FALSE,1458,1175,Kevin,286,user,1598,3,"I love live music especially small venue shows. This place has great potential. A few observations. 

The smell? Could not put my nose to it, but combo of smokers out front mixed with diesel fumes Sterno and feet?? My nose got athletic in a hurry. 

Filled with a dozen patrons when I arrived early for a show, I think that was also the average amount of teeth per person me excluded. I heard more trailer park cliches in the first half hour, you would think I had tapped into a text session between Brittney and K-Fed. Signs read, ""you mess with me you mess with the whole trailer park"". Got a plank of wood for a shelf behind the bar that is problematic for the tenders heads? No worries, pad it with bar naps and duct tape the shit out of it. Fixed. Get er done. 

My first beer was given at day prices, yippee. A majority of this fun loving crowd enjoyed their libations pitcher style with a double straw, including the tenders, you have to love that. Long hairs, biker chicks, shit kickers, tatted pierced southern rock rebel flag waving group. I held back my inner redneck and did not yell ""freebird"", but she-ite it was almost to hard to resist. Good times were being had by all. 

Music sounded okay I suppose, but the sound man and board are in a shitty spot. Tweak, run out to the middle back to tweak. Took at least a dozen trips to dial it in. 

This place has a back door for when someone has one pitcher too many!",review,5,bcZd4ohK6CIT_BOQ0_O53w
52105,FALSE,Burgers; Hot Dogs; American (New); Restaurants,Tempe,"3141 S McClintock Dr
Ste 13
Tempe, AZ 85282",eIxSLxzIlfExI6vgAbn2JA,33.3947699,-111.9088938,Lobbys Beef Burgers Dogs,NA,TRUE,181,4.5,AZ,business,0,3/23/2011,0,#NAME?,3.49,FALSE,15,19,Cori,61,user,63,4,"Ok, so I wrote a review after going to Lobby's the first time. I had a bad experience with the food but a great one with the employees. 

After receiving a very nice letter from one of the managers (or owner, not quite sure) I returned to give Lobby's another shot. For the first round I got the Italian Beef sandwich. Here's the rundown:

1. Beef was very very tender and there was no fat present. It just fell apart. Lovely.
2. Very, very salty. I stopped eating everything except the beef because of this, and I still refilled my drink twice.
3. The bun withstood the juice much better then the hot dog bun had. I was pleased.

So as far as that goes, I dunno. It would have been better if there wasn't so much salt. I give it a C+.

But because at this point I had tried a hot dog, and a sandwich I figured I should at least try the burger before writing this place off (again). 

Good decision!

The burger was fantastic. Run down:

1.The beef was perfectly cooked (and seasoned). 
2.The lettuce was crisp and fresh, the tomatoes were thick cut and fresh. 
3.The grilled onions were amazing.

I took one bite and realized that Lobby's Beefy burgers are amazing. And I would definitely return for one of these. I give the burger an A+.

And as always, the service was nice and friendly.

So if you just want a good burger, and don't care about the other stuff (fries looked good but I didn't get any), Lobby's may be a good choice. But if you want a hot dog or sandwich it may be best to get that somewhere else.

PS: The store is VERY clean.",review,2,#NAME?
90088,FALSE,Pubs; Bars; Nightlife; Lounges,Tempe,"526 S Mill Ave
Tempe, AZ 85281",NIuaxYvM_-dzmgGXwPJ1Gw,33.424522,-111.940409,World Of Beer,NA,TRUE,66,3,AZ,business,0,10/7/2012,0,gKVlnNfKcY9wJbuAYQKDvw,3.28,FALSE,6,6,Melinda,32,user,16,2,"Just popped my head in here quickly, looking to watch football.  LOTS of beer, and the place was packed but they dont serve any food!",review,1,L8NC1S3O0AgBwrysvG1wfw
229480,FALSE,Chinese; Restaurants,Phoenix,"5037 W Thomas Rd
Phoenix, AZ 85035",-7XuLxfYwZ9x72mEKXdv0A,33.48001,-112.167718,Lin's Golden Chinese Restaurant,NA,TRUE,7,4.5,AZ,business,0,11/15/2012,0,1O1nsh9AF_DWSMLgQgChUw,5,FALSE,0,0,John,1,user,1,5,"There're food are very good, you can taste the different to other restaurant, fresh cook and delicious. The house Lo Mein are the favorite dish.",review,1,4ajqdO-9RtxrwTHm9QpVSg
150922,FALSE,Pet Groomers; Pet Services; Pets; Pet Stores,Phoenix,"3855 E Thomas Rd
Phoenix, AZ 85018",rXokveEDu3PEtmd_-_4IIQ,33.4804393,-111.9995818,PetSmart,NA,TRUE,13,3.5,AZ,business,3,1/31/2011,2,m9DNH531b0wKe6HyttThIw,3.67,FALSE,1155,803,Dolores,481,user,1453,3,"While I most often go to the PetSmart in the complex of shops off Highland/Camelback and 20th St, occasionally I stop in here.  Mostly out of conveninece when I come to the Wal Mart, located in the same block of stores, then I will get my cat food here at this location. But I only get to Wal Mart about once every 2 months.   

This location is just as clean and the staff just as friendly as other locations I have been to in the area.  
They do have have a pet hospital and offer grooming services.  Not all PetSmart 
Nothin' special, but nothin' to complain about either.",review,2,usQTOj7LQ9v0Fl98gRa3Iw
106485,FALSE,American (Traditional); Comfort Food; Barbeque; Restaurants,Phoenix,"4716 E Ray Rd
Phoenix, AZ 85044",fsQFHGMbqWf7MT6KYMuJxQ,33.320241,-111.982787,Boston Market,NA,TRUE,4,4,AZ,business,1,11/17/2010,1,WQSlqW8_fbJhWfRKXQQmJQ,0,TRUE,0,0,NA,0,user,0,1,"Where's the beef?

Boston Market on a Friday night, thought I'd stop by for some quick comfort food before heading to the movies. It was not busy but they way they handled everything you would have thought it was packed. 

They must have some new employee issues because I got one taking my order. I ordered a carver sandwich. My child ordered mac and cheese of course. It seemed to be a language barrier when I said Brisket carver sandwich on WHEAT. She repeated back to me three times insisting I do the combo. Ok maybe it only comes as a combo so I say yes. She tells the cook  ""half beef on white"" and I quickly correct her. WHEAT please.  

Some sort of holdup and they say they will bring to it to the table for us.  We get our Mac N Cheese and drinks and sit. A few minutes later the 1/2 carver arrived wrapped and ready togo.  No au jus for dipping. No salad. Just a 1/2 sandwich. She says ""I'm sorry"" and realizes she forgot the rest of the order and quickly goes back to get the missing food. The manager comes by and asks what is wrong as he is apologizing to every table. He was the manager of ""I'm sorry"". She comes back with the food and leaves. The sandwich had 2 small skinny pieces of beef on it that did not even cover the roll. No swiss and no mayo. The au jus was warm at best. The salad was fine. I was extremely disappointed in the carver sandwich. For $6 I do think there should be meat on the sandwich. 

To be quite honest the last few times I have been to this location they are slipping. It will be a few months before I go back if I ever go back. The manager did bring me a one free corn muffin. Hint hint...Nice jester but dessert would have been better. 

Just very disappointed in the whole experience.",review,1,PA3ztLFGwZgbV_q1FqwcAA
211915,FALSE,Chinese; Restaurants,Phoenix,"668 N 44th St
Phoenix, AZ 85008",jbKVbSz51F8IcewsiRQu4A,33.4552907,-111.9878697,Golden Buddha,NA,FALSE,140,3,AZ,business,0,2/9/2012,1,tGtCrRig364e2pECy0ZuvQ,3.13,FALSE,89,89,Erin,351,user,325,2,"I agree with Crystal C., that the dim sum isn't the greatest I've ever had. In fact, I am not sure if the meal was so tasty that it was memorable. I do remember the ""calamari"" was not really calamari, like you would think. It was presented more like a sweet and sour pork (so calamari with LOTS of breading) without any sauce. As a result, the dish was dry and salty.

The sticky rice was good (hard to mess up), the chicken feet were okay (needed more five spice powder), and the shumai was alright. The noodles were good, and I can see why the cart ran out after the first round. The diners were an equal mix of Asians and Americans. I would've preferred to see more Asians eating (as I am used to in a Chinatown and gives an indication of authenticity), but I do realize we're in Phoenix where the Asian population is not like San Francisco or Houston. 

The meal came to about $30 for two, including jasmine tea. The carts are loud because they are made out of metal and roll on tile. I am also not used to staff members shouting what they have in their cart, like a newspaper boy yelling ""Extra! Extra!"" Christmas music was playing after mid-January, so the atmosphere felt strange. Next time I visit the city, I probably will pass.",review,0,L3Jsd79upFBPk2z4EBOsVQ
27036,FALSE,Burgers; Restaurants,Avondale,"9915 W McDowell Rd
Ste 101
Avondale, AZ 85392",tr4L9VWmPGZtdBD-L2Pofw,33.4641,-112.273257,Smashburger,NA,TRUE,77,4,AZ,business,0,8/5/2012,0,ny_TCUzGDNNMs5Hnf7hTnw,3.93,FALSE,3,1,Shannon,15,user,6,5,This was a great burger experience. I had he bbq bacon burger and smash fries. I called in the order and ate most of the fries on my 10 minute ride home because I was afraid that thy would be nasty cold. I was wrong! My fiance had the sweet potato fries. They were still yummy once we got them home. I have driven by this place many times and will be back soon!,review,0,dwk15l9aIvwfEWS7ZYq9Ag
22542,FALSE,Breakfast & Brunch; Restaurants,Phoenix,"801 N 1st St
Phoenix, AZ 85004",ntN85eu27C04nwyPa8IHtw,33.45669606,-112.0723271,Matt's Big Breakfast,NA,TRUE,689,4,AZ,business,0,6/16/2012,0,7mAZ7GWaSy2yiR7cUWbkvw,4.22,FALSE,8,6,Britt,27,user,17,5,"I was afraid this place would be overrated, because most breakfast places are. I usually think, how hard is it to cook up some eggs? and most places can't cook pancakes and waffles better than my mom. I was very wrong, this place was so, so, sooooo good. I had the salami egg scramble with hash browns, everything was cooked perfectly. The toast that came with fresh preserves and butter was amazing! My husband had the waffle with REAL maple syrup (a requirement in my mind) and sorry mom, but this one was actually better than yours. With the waffle came a side of the thickest, most flavorful bacon I've ever had. I would come back here for the bacon alone! This place is well worth the wait.",review,1,2hXL2ExBsgjJNpm6BJy0lg
179932,FALSE,Sushi Bars; Restaurants,Goodyear,"2293 N Pebble Creek Pkwy
Ste 101
Goodyear, AZ 85338",x0NOgX6P4x-82cC0kcO1hg,33.47209058,-112.3920143,Akai Hana Sushi & Grill,NA,TRUE,44,4,AZ,business,0,2/18/2012,0,cpZngunou7B1WPluxzH_Ug,4.67,FALSE,1,1,Melanie,10,user,9,5,"This place is one of the best sushi places (if not the best for their variety and made to orders) we have ever been to.  Each visit, we order something new (and we've been coming here once a week for several months now).  The cut and quality of the sashimi is consistent, the rolls are always prepared immaculately.  The miso soup is perfect.  Do not believe the negative reviews.  Believe the reviews of those of us who come here on a regular basis to enjoy fine quality sushi.  I have never seen this place short staffed, nor have I had a roll that fell apart because it wasn't prepared properly.  We have never waited long for our food, ever.",review,1,qh6XgAglRGxZww_h7Do5Vg
131269,FALSE,Beauty & Spas; Nail Salons,Surprise,"15643 N Reems Rd Ste 104
Surprise, AZ 85374",7P9XY8EoBr-Ksoh3Xtq0Xg,33.626292,-112.393742,Wild Nail,NA,TRUE,8,4,AZ,business,0,8/28/2012,0,TIyB_8Yhk3Crd57i8wsx3A,3.25,FALSE,1,1,D,8,user,4,1,I'm sorry this is an incorrect post,review,0,er51B8EPsYeJj-sX2Nw4gQ
51729,FALSE,Sandwiches; Restaurants,Phoenix,"4700 N 16th St
Phoenix, AZ 85016",-8wyZkzfBmCFkMwCGcR4PQ,33.505884,-112.047907,Pugzie's,NA,FALSE,33,3.5,AZ,business,0,3/6/2012,0,07D3ppIQxXrwgKIBbYz9YQ,2.95,FALSE,24,61,Jason,157,user,132,2,"Meh. It's a sandwich. I had the pastrami on rye. The rye was not very rye. I prefer strong rye. They microwaved it. The pasta salad was less than thrilling. I was hungry, it did the job but I won't be back. Not as great as most say it is. Plus the old folks home theme is something! Holy!! It's disgusting really!",review,2,ePduC-tSwrMQRjKI4Suh7Q
99539,FALSE,Bars; Nightlife,Scottsdale,"4251 N Winfield Scott Plz
Scottsdale, AZ 85251",fjAQGf-iJlVjD2vizzuORQ,33.4982604,-111.9251128,Giligin's Bar,NA,TRUE,124,3.5,AZ,business,11,8/3/2009,9,MO3KDz83khAb5rsIPTW8QA,4.05,FALSE,2457,2267,AMber,322,user,2851,3,"I came to this bar once right after I turned 21. At the time I thought it was cool because A) I was already drunk B) I got some weird fruity drink in a coconut shell C) My friend who was two years older than me told me it was cool and I am highly suggestible.

My second trip (yesterday) was as part of a group of 24 for my little baby sisters 21st birthday. This time, being the professional that I am now, I knew that this place was NOT cool, even thought at the time, I was already VERY drunk.

They have a cool theme going, but the ... let's say ""less than friendly"" bartenders completely ruined any type of possibility for fun. They either hated themselves or hated the world. Who knows.

The one thing I did really enjoy was the plunger shot my sister had to do, although, I think that it was what set her over the edge. Thankfully this was the last stop of the night. 

I don't hate this place, but I don't love it. I don't know that under normal circumstances I would have a good time. Although, I did get a picture with a plastic Captain and there is a wooden swing at the bar... but I'm just not that into pirates.",review,9,MWt24-6bfv_OHLKhwMQ0Tw
89004,FALSE,Pizza; Restaurants,Phoenix,"2805 West Carefree Highway
Phoenix, AZ 85086",cN4gmlntyQ-maTW4PdT-Kw,33.7982936,-112.1204014,Streets of New York,NA,TRUE,10,3,AZ,business,0,8/26/2012,0,JC80bHJzwl81eqoLY067RQ,2.7,FALSE,0,6,Lisa,10,user,12,2,"Doing the delivery thing lately - don't know if they have had a change in food purveyors or just wanted to cut their food cost, but it just doesn't taste like it used to.  It's too bad because we have a  number of choices for Pizza (not including ""Ray's"" - as nasty as it gets) - and it's easy enough to try someone else.",review,1,lXlt790HRJX7fIsq7aTN-Q
220275,FALSE,Burgers; Steakhouses; Barbeque; Restaurants,Tempe,"2000 E Rio Salado Pkwy
Ste 2105
Tempe, AZ 85281",K845ZDttFfx99zQ-0aE2tA,33.4329724,-111.9043028,Cadillac Ranch,NA,TRUE,137,2.5,AZ,business,0,11/18/2010,0,h9Gywm8Hlut9vtw0VV53OA,3.97,FALSE,11,44,greg,36,user,29,5,"Well we returned to caddy ranch for dinner, as the management really does care about the reviews, we were invited back for a ""make up"" dinner...   BLOWN AWAY.  Like I said before, the food was phenomenal my  chicken fried steak was AMAZING.. I'm sure the reason for inviting us back was not to pad the review or get me to change what i said, just to change my outlook on the establishment, which they did indeed.. prob would just take my own advice and realize the food is AWESOME and original , and above all they really do care about whether you would return or suggest them to friends. I will definitely do both now!!!    Good Job Caddy Ranch!!",review,0,YZHCm5e-d0wu9ssUIipexw
223967,FALSE,Active Life; Parks,Phoenix,"1 N Central Ave
Phoenix, AZ 85073",E0e5kYVua-LdFcJhC2ckeA,33.448654,-112.073195,Patriot's Square Park,NA,TRUE,3,1,AZ,business,2,1/26/2008,0,UPqbKzZaenaQoZp6fT0gMA,3.74,FALSE,1053,759,Pierre Trudeau,356,user,1298,1,"Patriots Square Park is a symbolic scourge of downtown Phoenix, whose demise I eagerly anticipate. Constructed in 1976 with good intentions, the 2.5 acre park was never a success. A charming amphitheatre looks like it would be perfect for a small jazz concert or other musical event, but to date I have never heard of a single concert playing here. Despite its location in the heart of our city's financial district, no downtown professionals I know ever spend any time there except to scurry past the bums, who've taken it over, to the elevators, which take them to the underground parking structure for the nearby courts and other buildings. It is, or was, to be avoided both day and night. The homeless have always run the place. Although the city cleaned and maintained it regularly, it still smelled like pee. If you dared to walk through it at night, you'd see cockroaches running before every step you took. It was nasty. 

When the plan to demolish it for the new Cityscape project was proposed, some community activists put up a major fuss in protest. I don't know why and I don't care. I live in downtown Phoenix. I have taken 100% of my assets and hard-earned savings and invested them in this area. I'm here for the long haul, and I used my vote and my voice to support the new plans. 

Patriots Park is no longer fully accessible, as it has been fenced off for future demolition.  Many people who grew up in Phoenix have nostalgic feelings about the place, because in its heyday I'm sure it was a much different experience. But it simply hasn't worked out in the long run. In keeping with the constant theme that is a part of our fine city, it is time to reinvent and move on.",review,5,17PPxx8RxjOUD_nQZ1aHEw
6448,FALSE,Hotels & Travel; Resorts; Event Planning & Services; Hotels,Scottsdale,"7500 E Doubletree Ranch Rd
Scottsdale, AZ 85258",xtX2qS64zP2NRPV_7NNqHw,33.5670375,-111.9184649,Hyatt Regency Scottsdale Resort & Spa at Gainey Ranch,NA,TRUE,135,4.5,AZ,business,0,11/5/2011,0,MBUxmQjbJDRiL-mjAy99dw,4,FALSE,1,1,Shawn,9,user,0,5,Awesome pool.,review,0,3JR8Z1-qdWOWEDycbrIflQ
86027,FALSE,Food; Coffee & Tea,Peoria,"7407 W Bell Rd
Peoria, AZ 85382",jDZS6BUrz5PI-M4iQCTMsg,33.6379403,-112.2183588,The Coffee Bean & Tea Leaf,NA,TRUE,21,4,AZ,business,0,4/29/2011,0,Rjf08QHq4SCGZHdKQMHYug,4.18,FALSE,7,10,'Tj,28,user,26,4,"like I said before, this place knows how to make a GREAT hazelnut mocha",review,1,1gspFi59uDO00PSM5LMlhQ
102,FALSE,Bakeries; Food,Gilbert,"1034 N Gilbert Rd
Suite 3
Gilbert, AZ 85234",M3zLQRbSF_VcGukkzxXc4w,33.369186,-111.790436,Phoenix Cake Company,NA,TRUE,4,4,AZ,business,0,6/15/2010,0,1e_YRoF0lrA9-4tvdym_Sg,5,FALSE,0,0,Cindy,1,user,1,5,"Christy is an amazing cake artist.  She has an impressive portfolio as she has a flair for creativity.  Her cakes are amazing and are truly one-of-a-kind.  She also has several delicious cake flavors to choose from or she can create one for you.   She has made several cakes for our family and I have been impressed with everyone of them.  I was also excited to see her compete on TLC's Ultimate Cake Off show early this spring.  If you're looking for a sculpted cake or one that will be the center of attention at your next party, then I recommend you call Phoenix Cake Company.",review,0,_w_hrcZ-9uObIBepDmLJwg
193181,FALSE,Sushi Bars; Japanese; Restaurants,Scottsdale,"6989 N Hayden Rd
Ste A12
Scottsdale, AZ 85250",Bjt3rB73dvSDe1XEPEWc6w,33.5381018,-111.9085143,Sakana Sushi & Grill,NA,TRUE,141,4,AZ,business,0,12/5/2010,0,9CWhSIog7c_uG2zVcRgCxg,3.67,FALSE,91,45,Ziyu,79,user,151,4,"I like Sakana! 

Great food, friendly service, and very casual/family-styled atmosphere... I was here twice in the last two weeks, both visits were great! Their price is very affordable compare to any good Japanese restaurants in the valley, and the rolls aren't small at all! 

Just come hungry and you'll leave happily satisfied ^.^",review,1,LaEj3VpQh7bgpAZLzSRRrw
139608,FALSE,Chinese; Restaurants,Phoenix,"668 N 44th St
Phoenix, AZ 85008",jbKVbSz51F8IcewsiRQu4A,33.4552907,-111.9878697,Golden Buddha,NA,FALSE,140,3,AZ,business,0,12/10/2008,0,XqtcjU9d8bDccPQ3O1EQVA,3.3,FALSE,1,1,Ron,10,user,2,1,"If you are looking a chinese restaurant to host a big party look some other than the Golden Buddah.  I recently attended a banquet at the Golden Buddah and I was shocked at the level of quality of food and service.  Of the 10 dishes served 4 were nearly inedible.  

There was a crab claw appetizer, most chinese restaurants prepare this dish by taking a crab claw surrounding it with ground shrimp, batter and then deep fry.  At Golden Buddah, the crab claw served was mostly batter.  

The shark fin soup served was mostly broth.  Shark fin is an expensive ingredient and most places usually use imitation shark fin, but come on at least put something in there so that I know I'm eating soup and not dirty sink water.  

Ginger scallion lobster is battered, fried, and then stir fried in a sauce with ginger and scallions.  The ginger scallion lobster served was over-cooked and dried out.  

Lastly, there was a steamed fish.  The fish was raw in the middle.   

It wasn't all bad, there was a crispy chicken with garlic dish that was pretty good, but out of 10 dishes 4 were bad, 5 were okay, and 1 was good.  

Does 4 bad dishes out of 10 warrant a one star rating?  Well it does when you factor in the service.  The soup, appetizer, and first entree arrived timely, but after that there was a 1 hour gap before we received the next dish.  The dishes were not served with accompanying white rice which I thought was odd.  We had to ask for it, and even the rice took a while to arrive.",review,1,V1UCsFJZVFM9N_T095TiIw
66892,FALSE,Hot Dogs; Restaurants,Phoenix,"53 W Thomas Rd
Phoenix, AZ 85013",FlZ5dTvuoPls8OuXfUAwqg,33.479992,-112.076718,Johnnie's Chicago Red Hots,NA,TRUE,24,4,AZ,business,0,8/22/2010,0,nBw05uUF-9MkxZeAPoYJxw,3.57,FALSE,28,26,Ryan,53,user,61,4,"Quick and tasty ""Chicago-style"" dogs from one of the friendliest people I have met. If you're feeling brave or hard-core, try the garbage dog!",review,0,bDPFpoB-Uaf_nPBS5tF6Jg
